Review,Categories
AutoFinance Loans' customer service was unresponsive when I sought assistance with my loan application.,Customer Service
"FirstCredit Union's home loan department made errors in my paperwork, causing delays and frustration.","Paperwork Errors, Delays"
"I encountered unauthorized transactions on my SafeGuard Bank account, and their fraud resolution process was frustratingly slow.","Unauthorized Transactions, Slow Resolution"
"TrustyCredit Union's mortgage application process was agonizingly slow, and there were multiple errors in my paperwork.","Mortgage Process, Paperwork Errors"
Their mobile app frequently crashes and has issues with account synchronization.,"Mobile App Crashes, Account Sync Issues"
"I encountered various challenges with Trustworthy Bank's mortgage process. It was slow, and there were numerous errors.","Mortgage Process, Errors"
Their mobile app is unreliable and frequently crashes.,Mobile App Issues
"I had unauthorized transactions on my GlobalBank account, and their fraud resolution process was slow.","Unauthorized Transactions, Slow Resolution"
QuickLoans' customer service left much to be desired when I sought assistance with my loan application.,Customer Service
QuickCredit Bank's auto loan department had poor communication and delayed my loan approval.,Communication Delays
"Unexpected fees on my EasyAccess Bank account were frustrating, and their customer service was unresponsive.","Unexpected Fees, Customer Service"
"I faced multiple issues with WealthGrow Bank's online banking. It was slow, and transactions were often delayed.",Online Banking Issues
"They mishandled my wire transfer, causing a delay.","Wire Transfer Mishandling, Delay"
"CashBack Bank raised my credit card interest rate without notice, which was disappointing.",Interest Rate Increase
"TransparentCredit Union's loan approval process experienced unexpected delays, causing considerable frustration during the waiting period.",Loan Approval Delays
"I had a dispute with CreditWise Bank over unauthorized transactions, and the resolution process was lengthy.","Unauthorized Transactions, Dispute Resolution"
"CashBack Master Bank raised my credit card interest rate without notice, which was disappointing and unexpected.",Interest Rate Increase
"CashBack Pro Bank raised my credit card interest rate without prior notice, which was frustrating and disappointing.",Interest Rate Increase
I had issues with SpeedyBank's mortgage department. They made errors in my application.,Mortgage Errors
"I encountered various challenges with Trustwise Bank's mortgage process. It was slow, and there were numerous errors.","Mortgage Process, Errors"
"Unexpected fees on my QuickCash Bank account left me frustrated, and the customer service was unresponsive.","Unexpected Fees, Customer Service"
"I encountered losses due to SecureInvest Bank's investment recommendations, and their fees were excessive.","Investment Losses, High Fees"
"ReliableBank's ATMs are often out of service, and their branch hours are inconvenient.","ATM Issues, Branch Hours"
"I experienced fraudulent activity on my SafeGuard Bank account, and their fraud resolution process was slow.","Fraudulent Activity, Slow Resolution"
I've had multiple issues with MoneyMasters Bank's online banking system. It's unreliable and frustrating.,Online Banking Issues
"I faced multiple issues with ProgressSaver Bank's online banking. It was slow, and transactions were often delayed.",Online Banking Issues
"SecureHome Loans unexpectedly increased my mortgage interest rate, which was disappointing.",Interest Rate Increase
I faced issues with BankPlus's online banking. It was slow and had login problems.,Online Banking Issues